[
  {
    "name": "visa-blue-primary",
    "value": "#1A1F71",
    "category": "color",
    "description": "Primary Visa brand blue color - the core brand color",
    "usage": ["primary buttons", "brand elements", "headers", "navigation", "call-to-action"],
    "deprecated": false,
    "aliases": ["primary-blue", "brand-blue", "visa-primary"]
  },
  {
    "name": "visa-blue-secondary",
    "value": "#3B82F6",
    "category": "color",
    "description": "Secondary blue for supporting elements and interactions",
    "usage": ["secondary buttons", "links", "accents", "hover states"],
    "deprecated": false,
    "aliases": ["secondary-blue", "interactive-blue"]
  },
  {
    "name": "visa-blue-light",
    "value": "#E6F2FF",
    "category": "color",
    "description": "Light blue for backgrounds and subtle highlights",
    "usage": ["background tints", "selected states", "info messages"],
    "deprecated": false,
    "aliases": ["light-blue", "background-blue"]
  },
  {
    "name": "visa-gold",
    "value": "#F7B801",
    "category": "color",
    "description": "Visa gold accent color for premium and success states",
    "usage": ["highlights", "success states", "premium features", "rewards", "achievements"],
    "deprecated": false,
    "aliases": ["gold", "accent-gold", "premium-gold"]
  },
  {
    "name": "visa-gold-dark",
    "value": "#D49C00",
    "category": "color",
    "description": "Darker gold for hover states and emphasis",
    "usage": ["gold button hover", "active gold elements", "gold text on light backgrounds"],
    "deprecated": false,
    "aliases": ["dark-gold", "gold-hover"]
  },
  {
    "name": "neutral-white",
    "value": "#FFFFFF",
    "category": "color",
    "description": "Pure white for backgrounds and contrast",
    "usage": ["page backgrounds", "card backgrounds", "button text", "icons on dark backgrounds"],
    "deprecated": false,
    "aliases": ["white", "background-white"]
  },
  {
    "name": "neutral-gray-50",
    "value": "#F9FAFB",
    "category": "color",
    "description": "Lightest gray for subtle backgrounds",
    "usage": ["section backgrounds", "disabled states", "subtle dividers"],
    "deprecated": false,
    "aliases": ["gray-lightest", "background-gray"]
  },
  {
    "name": "neutral-gray-200",
    "value": "#E5E7EB",
    "category": "color",
    "description": "Light gray for borders and dividers",
    "usage": ["borders", "dividers", "input outlines", "card edges"],
    "deprecated": false,
    "aliases": ["gray-light", "border-gray"]
  },
  {
    "name": "neutral-gray-500",
    "value": "#6B7280",
    "category": "color",
    "description": "Medium gray for secondary text and icons",
    "usage": ["secondary text", "placeholder text", "inactive icons", "captions"],
    "deprecated": false,
    "aliases": ["gray-medium", "text-secondary"]
  },
  {
    "name": "neutral-gray-900",
    "value": "#111827",
    "category": "color",
    "description": "Dark gray for primary text and high contrast elements",
    "usage": ["primary text", "headings", "active icons", "high contrast elements"],
    "deprecated": false,
    "aliases": ["gray-dark", "text-primary"]
  },
  {
    "name": "semantic-success",
    "value": "#10B981",
    "category": "color",
    "description": "Green for success states and positive feedback",
    "usage": ["success messages", "completed states", "positive indicators", "checkmarks"],
    "deprecated": false,
    "aliases": ["green", "success-green"]
  },
  {
    "name": "semantic-warning",
    "value": "#F59E0B",
    "category": "color",
    "description": "Orange for warning states and caution indicators",
    "usage": ["warning messages", "caution states", "pending indicators", "attention alerts"],
    "deprecated": false,
    "aliases": ["orange", "warning-orange"]
  },
  {
    "name": "semantic-error",
    "value": "#EF4444",
    "category": "color",
    "description": "Red for error states and critical alerts",
    "usage": ["error messages", "validation errors", "critical alerts", "destructive actions"],
    "deprecated": false,
    "aliases": ["red", "error-red"]
  },
  {
    "name": "font-family-primary",
    "value": "\"Visa Sans\", -apple-system, BlinkMacSystemFont, \"Segoe UI\", Roboto, sans-serif",
    "category": "typography",
    "description": "Primary font family for all text elements",
    "usage": ["all text", "headings", "body text", "interface text"],
    "deprecated": false,
    "aliases": ["font-primary", "visa-font"]
  },
  {
    "name": "font-family-monospace",
    "value": "\"SF Mono\", Monaco, \"Cascadia Code\", \"Roboto Mono\", Consolas, monospace",
    "category": "typography",
    "description": "Monospace font for code and technical content",
    "usage": ["code blocks", "technical data", "account numbers", "reference codes"],
    "deprecated": false,
    "aliases": ["font-mono", "code-font"]
  },
  {
    "name": "font-size-xs",
    "value": "12px",
    "category": "typography",
    "description": "Extra small font size for captions and fine print",
    "usage": ["captions", "fine print", "legal text", "metadata"],
    "deprecated": false,
    "aliases": ["text-xs"]
  },
  {
    "name": "font-size-sm",
    "value": "14px",
    "category": "typography",
    "description": "Small font size for secondary text",
    "usage": ["secondary text", "labels", "helper text", "form descriptions"],
    "deprecated": false,
    "aliases": ["text-sm"]
  },
  {
    "name": "font-size-base",
    "value": "16px",
    "category": "typography",
    "description": "Base font size for body text and standard interface elements",
    "usage": ["body text", "default text", "form inputs", "buttons"],
    "deprecated": false,
    "aliases": ["text-base", "font-normal"]
  },
  {
    "name": "font-size-lg",
    "value": "18px",
    "category": "typography",
    "description": "Large font size for emphasized text",
    "usage": ["emphasized text", "large buttons", "important labels"],
    "deprecated": false,
    "aliases": ["text-lg"]
  },
  {
    "name": "font-size-xl",
    "value": "20px",
    "category": "typography",
    "description": "Extra large font size for sub-headings",
    "usage": ["sub-headings", "section titles", "card titles"],
    "deprecated": false,
    "aliases": ["text-xl"]
  },
  {
    "name": "font-size-2xl",
    "value": "24px",
    "category": "typography",
    "description": "2X large font size for headings",
    "usage": ["headings", "modal titles", "section headers"],
    "deprecated": false,
    "aliases": ["text-2xl", "heading-2"]
  },
  {
    "name": "font-size-3xl",
    "value": "30px",
    "category": "typography",
    "description": "3X large font size for major headings",
    "usage": ["major headings", "page titles", "hero text"],
    "deprecated": false,
    "aliases": ["text-3xl", "heading-1"]
  },
  {
    "name": "font-size-4xl",
    "value": "36px",
    "category": "typography",
    "description": "4X large font size for display text",
    "usage": ["display text", "hero titles", "marketing headers"],
    "deprecated": false,
    "aliases": ["text-4xl", "display"]
  },
  {
    "name": "font-weight-normal",
    "value": 400,
    "category": "typography",
    "description": "Normal font weight for body text",
    "usage": ["body text", "default text", "paragraphs"],
    "deprecated": false,
    "aliases": ["weight-normal"]
  },
  {
    "name": "font-weight-medium",
    "value": 500,
    "category": "typography",
    "description": "Medium font weight for emphasis",
    "usage": ["emphasized text", "labels", "button text"],
    "deprecated": false,
    "aliases": ["weight-medium"]
  },
  {
    "name": "font-weight-semibold",
    "value": 600,
    "category": "typography",
    "description": "Semi-bold font weight for headings",
    "usage": ["headings", "section titles", "important text"],
    "deprecated": false,
    "aliases": ["weight-semibold"]
  },
  {
    "name": "font-weight-bold",
    "value": 700,
    "category": "typography",
    "description": "Bold font weight for strong emphasis",
    "usage": ["strong emphasis", "major headings", "call-to-action text"],
    "deprecated": false,
    "aliases": ["weight-bold"]
  },
  {
    "name": "line-height-tight",
    "value": 1.25,
    "category": "typography",
    "description": "Tight line height for headings",
    "usage": ["headings", "titles", "compact text"],
    "deprecated": false,
    "aliases": ["leading-tight"]
  },
  {
    "name": "line-height-normal",
    "value": 1.5,
    "category": "typography",
    "description": "Normal line height for body text",
    "usage": ["body text", "paragraphs", "default text"],
    "deprecated": false,
    "aliases": ["leading-normal"]
  },
  {
    "name": "line-height-relaxed",
    "value": 1.625,
    "category": "typography",
    "description": "Relaxed line height for improved readability",
    "usage": ["long-form text", "articles", "documentation"],
    "deprecated": false,
    "aliases": ["leading-relaxed"]
  },
  {
    "name": "spacing-0",
    "value": "0px",
    "category": "spacing",
    "description": "Zero spacing for tight layouts",
    "usage": ["no spacing", "tight layouts", "reset margins"],
    "deprecated": false,
    "aliases": ["space-0"]
  },
  {
    "name": "spacing-1",
    "value": "4px",
    "category": "spacing",
    "description": "Smallest spacing unit for tight spacing",
    "usage": ["tight spacing", "small gaps", "fine adjustments"],
    "deprecated": false,
    "aliases": ["space-1", "spacing-xs"]
  },
  {
    "name": "spacing-2",
    "value": "8px",
    "category": "spacing",
    "description": "Small spacing unit for component padding",
    "usage": ["component padding", "small margins", "icon spacing"],
    "deprecated": false,
    "aliases": ["space-2", "spacing-sm"]
  },
  {
    "name": "spacing-3",
    "value": "12px",
    "category": "spacing",
    "description": "Medium-small spacing for form elements",
    "usage": ["form element spacing", "button padding", "input padding"],